{
  "event_id": "change-slogan",
  "tenant_id": "demo-tenant",
  "project_id": "demo-project",
  "snapshot_hash": "a9f511192369d7a8bceddf0134c17c0879a4b2917b7737aabc389cb81057062f",
  "policy_version": "v1",
  "decisions": [
    {
      "node_id": "copy",
      "action": "RECOMPUTE",
      "reasons": ["slogan-copy: changed HARD input/version"],
      "input_fingerprint": "189646038ef073a6306c5a27eac7f91721907bf1985cee3f8e5d4297428ac6da",
      "evidence_ids": ["evidence"]
    },
    {
      "node_id": "evidence",
      "action": "KEEP",
      "reasons": ["no affected dependency"],
      "input_fingerprint": "41ac9bab8f2bce9b9504c6cfb88cc38ae9d14b99efdf4058a6ffafefe1032986",
      "evidence_ids": []
    },
    {
      "node_id": "logo",
      "action": "KEEP",
      "reasons": [
        "slogan-logo: informational edge; does not require recomputation"
      ],
      "input_fingerprint": "189646038ef073a6306c5a27eac7f91721907bf1985cee3f8e5d4297428ac6da",
      "evidence_ids": ["evidence"]
    },
    {
      "node_id": "note",
      "action": "KEEP",
      "reasons": ["no affected dependency"],
      "input_fingerprint": "41ac9bab8f2bce9b9504c6cfb88cc38ae9d14b99efdf4058a6ffafefe1032986",
      "evidence_ids": []
    },
    {
      "node_id": "slogan",
      "action": "KEEP",
      "reasons": ["no affected dependency"],
      "input_fingerprint": "41ac9bab8f2bce9b9504c6cfb88cc38ae9d14b99efdf4058a6ffafefe1032986",
      "evidence_ids": ["evidence"]
    },
    {
      "node_id": "storyboard",
      "action": "RECOMPUTE",
      "reasons": ["copy-storyboard: changed HARD input/version"],
      "input_fingerprint": "29b7c22a636e1ba817433e36b4d6c0f306c80e99d804a23e512a76cb7cd4210b",
      "evidence_ids": ["evidence"]
    },
    {
      "node_id": "visual",
      "action": "REVIEW",
      "reasons": ["slogan-visual: SOFT impact unknown; human review required"],
      "input_fingerprint": "189646038ef073a6306c5a27eac7f91721907bf1985cee3f8e5d4297428ac6da",
      "evidence_ids": ["evidence"]
    },
    {
      "node_id": "visual_export",
      "action": "REVIEW",
      "reasons": ["visual-visual_export: HARD input pending human review"],
      "input_fingerprint": "009cd65229341a2f585581e336c3be6ae72babebd876898ce8de23bab2d9ae9c",
      "evidence_ids": ["evidence"]
    }
  ],
  "traces": [
    {
      "edge_id": "copy-storyboard",
      "upstream_id": "copy",
      "dependent_id": "storyboard",
      "strength": "HARD",
      "action": "RECOMPUTE",
      "reason": "changed HARD input/version"
    },
    {
      "edge_id": "slogan-copy",
      "upstream_id": "slogan",
      "dependent_id": "copy",
      "strength": "HARD",
      "action": "RECOMPUTE",
      "reason": "changed HARD input/version"
    },
    {
      "edge_id": "slogan-logo",
      "upstream_id": "slogan",
      "dependent_id": "logo",
      "strength": "INFORMATIONAL",
      "action": "KEEP",
      "reason": "informational edge; does not require recomputation"
    },
    {
      "edge_id": "slogan-visual",
      "upstream_id": "slogan",
      "dependent_id": "visual",
      "strength": "SOFT",
      "action": "REVIEW",
      "reason": "SOFT impact unknown; human review required"
    },
    {
      "edge_id": "visual-visual_export",
      "upstream_id": "visual",
      "dependent_id": "visual_export",
      "strength": "HARD",
      "action": "REVIEW",
      "reason": "HARD input pending human review"
    }
  ],
  "execution_order": ["copy", "storyboard"],
  "non_publishable_ids": ["copy", "storyboard", "visual", "visual_export"],
  "expected_cost_usd": 0.0,
  "expected_latency_s": 0.2,
  "estimate_status": "SIMULATED",
  "plan_hash": "c34f57f2a61438fe311a97815f2871a7bfb23ff30ee925e07d83ec603d2168bf"
}
